{
    "medication": {
        "generic_name": "Aspirin [Ascriptin]",
        "strength": {
            "value": 500,
            "unit": "mg"
        },
        "rxnorm_code": 830525
    },

    "route": "oral",

    "schedule": [
        {
            "dose": {
                "value": 1,
                "unit": "tablet"
            },
            "dose_recurrence": {
                "number_of_times": 2,
                "time_window": {
                    "value": 1,
                    "unit": "d"
                },
                "time_between_successive_windows": {
                    "value": 1,
                    "unit": "d"
                }
            },
            "timing": [
                {
                    "time_of_day": "08:00:00",
                    "temporal_relationship_to_meal": "after breakfast"
                },
                {
                    "time_of_day": "20:00:00",
                    "temporal_relationship_to_sleep": "before sleeping"
                }
            ]
        },
        {
            "dose": {
                "value": 1,
                "unit": "tablet"
            },
            "prn_reason": "pain"
        }
    ],
    "prescription_duration": {
        "value": 15,
        "unit": "d"
    }
}