{
    "medication": {
        "generic_name": "Aspirin [Ascriptin]",
        "strength": {
            "value": 500,
            "unit": "mg"
        },
        "rxnorm_code": 830525
    },
    "route": "oral",
    "schedule": [
        {
            "dose": {
                "value": 1,
                "unit": "tablet"
            },
            "prn_reason": "pain"
        }
    ],
    "prescription_duration": {
        "value": 3,
        "unit": "Mo"
    }
}