{
    "medication": {
        "generic_name": "Aspirin [Ascriptin]",
        "strength": {
            "value": 325,
            "unit": "mg"
        },
        "rxnorm_code": 830530
    },
    "route": "oral",

    "schedule": [
        {
            "dose": {
                "value": 1,
                "unit": "tablet"
            },
            "dose_recurrence": {
                "number_of_times": 3,
                "time_window": {
                    "value": 1,
                    "unit": "wk"
                },
                "time_between_successive_windows": {
                    "value": 1,
                    "unit": "wk"
                }
            },
            "timing": [
                {
                    "part_of_day": "morning",
                    "day_of_week": "Monday"
                },
                {
                    "part_of_day": "morning",
                    "day_of_week": "Wednesday"
                },
                {
                    "part_of_day": "morning",
                    "day_of_week": "Friday"
                }
            ]
        },
        {
            "dose": {
                "value": 0.5,
                "unit": "tablet"
            },
            "dose_recurrence": {
                "number_of_times": 1,
                "time_window": {
                    "value": 1,
                    "unit": "wk"
                },
                "time_between_successive_windows": {
                    "value": 1,
                    "unit": "wk"
                }
            },
            "timing": [
                {
                    "part_of_day": "morning",
                    "day_of_week": "Saturday"
                }
            ]
        }
    ],
    "prescription_duration": {
        "value": 6,
        "unit": "Mo"
    }
}