{
    "medication": {
        "trade_name": "Tenormin 50 MG Oral Tablet",
        "strength": {
            "value": 50,
            "unit": "mg"
        },
        "rxnorm_code": 152414
    },

    "route": "oral",

    "schedule": [
        {
            "dose": {
                "value": 1,
                "unit": "tablet"
            },
            "dose_recurrence": {
                "number_of_times": 1,
                "time_window": {
                    "value": 1,
                    "unit": "d"
                },
                "time_between_successive_windows": {
                    "value": 1,
                    "unit": "d"
                }
            }
        },
        {
            "dose": {
                "value": 0.5,
                "unit": "tablet"
            },
            "dose_recurrence": {
                "number_of_times": 1,
                "time_window": {
                    "value": 1,
                    "unit": "d"
                },
                "time_between_successive_windows": {
                    "value": 2,
                    "unit": "d"
                },
                "part_of_day": ["evening"],
                "temporal_relationship_to_sleep": "before sleeping"
            }
        }
    ],
    "prescription_duration": {
        "value": 15,
        "unit": "d"
    }
}
