{
    "medication": {
        "generic_name": "Aspirin [Ascriptin]",
        "strength": {
            "value": 325,
            "unit": "mg"
        },
        "rxnorm_code": 830530
    },

    "route": "oral",

    "schedule": [
        {
            "dose": {
                "value": 1,
                "unit": "tablet"
            },
            "dose_recurrence": {
                "number_of_times": 2,
                "time_window": {
                    "value": 1,
                    "unit": "d"
                }
            }
        },
        {
            "dose": {
                "value": 1,
                "unit": "tablet"
            },
            "prn_reason": "pain"
        }
    ],
    "prescription_duration": {
        "value": 1,
        "unit": "Mo"
    }
}