{
    "medication": {
        "trade_name": "Trimox",
        "strength": {
            "value": 500,
            "unit": "mg"
        },
        "rxnorm_code": 94406
    },

    "route": "oral",

    "schedule": [
        {
            "dose": {
                "value": 1,
                "unit": "tablet"
            },
            "dose_recurrence": {
                "number_of_times": 1,
                "time_window": {
                    "value": 6,
                    "unit": "h"
                },
                "time_between_successive_windows": {
                    "value": 6,
                    "unit": "h"
                }
            }
        }
    ],
    "prescription_duration": {
        "value": 5,
        "unit": "d"
    }
}