{
    "medication": {
        "generic_name": "Aspirin [Ascriptin]",
        "strength": {
            "value": 500,
            "unit": "mg"
        },
        "rxnorm_code": 830525
    },
    "route": "oral",
    "schedule": [
        {
            "dose": {
                "value": 1,
                "unit": "tablet"
            },
            "dose_recurrence": {
                "number_of_times": 2,
                "time_window": {
                    "value": 1,
                    "unit": "d"
                },
                "parts_of_day": ["morning","evening"]
            }
        }
    ],
    "prescription_duration": {
        "value": 30,
        "unit": "d"
    }
}