{
    "medication": {
        "generic_name": "Aspirin [Ascriptin]",
        "strength": {
            "value": 325,
            "unit": "mg"
        },
        "rxnorm_code": 830530
    },

    "route": "oral",

    "schedule": [
        {
            "dose": {
                "value": 1,
                "unit": "tablet"
            },
            "dose_recurrence": {
                "number_of_times": 1,
                "time_window": {
                    "low_value": 4,
                    "high_value": 6,
                    "unit": "h"
                },
                "time_between_successive_windows": {
                    "low_value": 4,
                    "high_value": 6,
                    "unit": "h"
                }
            }
        }
    ],
    "prescription_duration": {
        "value": 3,
        "unit": "d"
    }
}