{
    "medication": {
        "trade_name": "Alendronic acid 70 MG Oral Tablet [Fosamax]",
        "strength": {
            "value": 70,
            "unit": "mg"
        },
        "rxnorm_code": 904433
    },
    "route": "oral",
    "schedule": [
        {
            "dose": {
                "value": 1,
                "unit": "tablet"
            },
            "dose_recurrence": {
                "number_of_times": 1,
                "time_window": {
                    "value": 1,
                    "unit": "wk"
                },
                "part_of_day": "morning",
                "day_of_week": "Sunday"
            }
        }
    ],
    "prescription_duration": {
        "value": 6,
        "unit": "Mo"
    }
}