{
    "medication": {
        "generic_name": "Aspirin [Ascriptin]",
        "strength": {
            "value": 325,
            "unit": "mg"
        },
        "rxnorm_code": 830530
    },
    "route": "oral",
    "schedule": [
        {
            "dose": {
                "value": 1,
                "unit": "tablet"
            },
            "dose_recurrence": {
                "number_of_times": 3,
                "time_window": {
                    "value": 1,
                    "unit": "wk"
                },
                "time_between_successive_windows": {
                    "value": 1,
                    "unit": "wk"
                },
                "part_of_day": "morning",
                "days_of_week": ["Monday","Wednesday","Friday"]
            }
        },
        {
            "dose": {
                "value": 2,
                "unit": "tablet"
            },
            "dose_recurrence": {
                "number_of_times": 4,
                "time_window": {
                    "value": 1,
                    "unit": "wk"
                },
                "time_between_successive_windows": {
                    "value": 1,
                    "unit": "wk"
                },
                "part_of_day": "morning",
                "days_of_week": ["Tuesday","Thursday","Saturday","Sunday"]
            }
        }
    ],
    "prescription_duration": {
        "value": 6,
        "unit": "Mo"
    }
}